Id,PostId,Text,CreationDate,UserId
1910,1719,"Yes, I would agree that they were a hybrid of zombies and vampires due to their appearance and aversion to sunlight.",2013-05-20 02:53:06.453,30
1916,1042,"The zombies didn't know where he lived, they just followed the scent of a regular human when he was brought back by people who didn't know any better. If the zombies were that smart, they would have been able to search the whole of Manhattan in the timeframe of how long Neville had been alone on the island.",2012-11-22 20:47:11.540,1024
1917,395,"http://www.enotes.com/topic/Norm_MacDonald Second paragraph of ""Post SNL Career""",2012-04-07 23:14:07.293,1017
1918,475,"While the examples from the book may be sound, this whole question is about the *movie*.  If this same question was asked on lit.se, then this would be a good answer, but this is about the movie, and as far as i can remember, no in-movie explanation was ever given about this.",2012-01-09 10:10:53.090,827
1919,1252,"@Tyler: Yeah, you're right. That's why I started my answer with ""from reading the books"". I just thought the answer might still help.",2013-01-07 12:37:43.563,1593
1920,353,This film has always been a guilty pleasure that lives in my collection.,2012-03-16 00:45:42.093,1013
1922,1413,"I read some pages from google results and all the user comments from youtube, and one of them said that could be taken from the movie [On Sacred Ground](http://www.imdb.com/title/tt1808362/). Did you checked this movie?",2013-02-18 03:25:29.717,1409
1923,1085,"@Shane Finneran, after reading your thoughts and the comments above I decide that I need to watch the movie again.  You are correct in that Cole's memory flashbacks did show Brad Pitt.  The 1st memory flashback you could just see the person fleeing the shooting.  The 2nd you got a better look at the virus spreading person, but could not see the face although you could see red hair.  In the 3rd flashback you could see the red haired person and it was Brad Pitt.",2012-12-06 00:30:06.557,351
1924,405,"(comment continued) This flashback happened after Cole had met the Brad Pitt character and I interpreted it as Cole was confusing his memory with the addition of Brad Pitt because he had never seen the face to the man before.  Brad Pitt didn't have red hair so it couldn't have been an altered timeline.  I never heard the insurance lady say anything about not liking the past, but I could have missed it.",2012-04-10 13:15:24.177,1223
1925,1611,"The only references I can find on ""On Sacred Ground"" are films from 1980 and 2009. The latter is eliminated for obvious reasons. The former seems to be a historical pic covering an aboriginal tribe dispute over mining rights. (http://www.abc.net.au/aplacetothink/html/sacred_ground.htm) So, I'm going to have to rule those out.",2013-04-21 06:56:03.847,896
1935,669,... It's not gay if it's with yourself... right?,2012-07-01 07:42:26.297,538
1936,1723,"I have no doubt it helps with the answer and the books themselves say flat out why.  I'm just trying to poke around and get people's reactions to answers to adaptations using the source material, rather than the movie itself :)",2013-05-20 09:16:44.373,128
1937,1598,LOL yeah. Dad caught them. It was a funny scene.,2013-04-16 01:04:11.783,971
1938,361,"@Tyler: Right, that's good. Then [here's another one for you](http://movies.stackexchange.com/a/1315). That's the answer I was just going to post `:-)`",2012-03-20 04:32:36.730,111
1939,1233,"Bruce Willis himself is 40 years old in the movie, but I don't know how old he's supposed to look.",2013-01-03 12:10:39.750,925
1941,359,"I want to have some story about the that time condition of Will Smith when he made the movie. I don't want to know about Chris Gardner, it's available in wikipedia already.",2012-03-19 09:34:00.967,1088
1943,373,Can you list where you 'heard' this information from?  Can you elaborate on your question at all?,2012-03-27 18:28:11.903,1121
1945,925,"The movie was based on boxing rather than free-style fighting, so I don't think there're any connections, though I'd appreciate that you've noticed those facts.",2012-10-06 00:29:49.157,1603
1949,598,I clarified the question bolding 'each release',2012-06-09 17:54:21.303,740
1950,500,Great! What a story!,2012-05-10 17:14:05.860,1357
1951,1323,"Because if you were looking for a serial killer and stumbled upon this guy you'd think "" Maybe this is him. "" also.",2013-01-25 07:49:18.983,445
1952,214,also see : http://scifi.stackexchange.com/questions/2286/in-canon-does-han-solo-shoot-first,2012-01-22 13:41:35.470,749
1954,43,That's cool I thought there would be a tag already but it didn't pop up when I entered Buffy. I was hoping someone would correct it if I was wrong.,2011-12-02 21:52:40.723,1267
1957,1493,"I find it quite amusing ... either George is deceiving himself, or he is a terrible director who managed to edit the first releases such that it clearly looks like Han shot first, despite it being the opposite of what he now claims he intended.",2013-03-16 05:16:25.380,168
1958,58,"@Kent Byerley, I like your theory about why Brad Pitt is in flashback 3...hmmm. Anyway, the quote is along the lines of ""I hope you haven't become addicted to that dying world"" and it might actually have been delivered by a different scientist. but ""dying world"" part is pronounced with disgust. bottom line, scientists are not trying to save past, they're trying ""to return to the surface of the earth"" as another scientist says.",2011-12-06 15:15:02.627,937
1959,21,The People's Champ was likely a reference to boxing legend Muhammad Ali.,2011-12-02 01:20:33.740,1226
1960,688,"Thank you for that Creator... @Legion600, good point",2012-07-08 13:14:48.147,1660
1961,1010,"I should've worded my question more appropriately. I should've used the word `subtle` somewhere cuz that's what I intended to say. There is no need for a people's elbow or a pedigree for associating  with WWE. And I am not saying that there is no reason for each of their behaviors. About the undertaker(a minor correction), only Atom does that situp not Zeus. I like the Zeus- fully automatic and Atom, more human bit of your answer",2012-11-09 14:38:10.283,1625
1962,1650,"You haven't given any concrete reason for your statement, but I do appreciate the reference to Richard Matheson.",2013-05-01 12:28:27.410,278
1963,1278,"@LelouchLamperouge, The bots has its unique boxing style.So don't confuse it with wrestling style.",2013-01-14 00:13:59.327,893
1964,1150,I understand that Jake and Ryan become rivals then potentially friends towards the end.  What I don't understand is why Max would get in the car with Ryan given he knew of the rivalry and Ryan's ruthlessness.,2012-12-20 07:56:03.023,655
1968,962,to me it seems like a harry potter quote - the hell why they included it - but the last rows pupils just reminds heavily to to Ron. and come on an owl emerging out of a burning fire place - in a meanwhile pretty serious plot - there must be crew's joke behind the scenes,2012-10-21 03:06:09.723,1326
1973,969,"The book series *The Three Investigators*, issue #14, [Mystery of the Coughing Dragon](http://www.threeinvestigatorsbooks.com/Coughdragon.html), also features the ""Tank-as-Dragon"" element. Was first published in 1970, written by Nick West who might have woven a nod to Ian Flemming into his yarn here...",2012-10-24 06:15:03.767,913
1974,1148,"Whilst this may theoretically answer the question, [it would be preferable](http://meta.stackexchange.com/q/8259) to include the essential parts of the answer here, and provide the link for reference.",2012-12-19 23:23:39.327,1572
1976,1710,"-1.  Sorry, doesn't show a lot of research.  It took me a short time to find sources for the fight at SNL, not Caddyshack.   The answer is good though.",2013-05-18 13:59:02.303,1538
1979,891,"It was also explained, I believe, that they have to see the damage incoming in order to protect themself",2012-09-20 05:44:39.650,215
1980,186,No problem. I wasn't sure where to look for actual sources rather than rumors. I had heard that it actually started on SNL but that didn't make sense to me since they have the scene in Caddyshack. The part I missed was Harold Ramis making it happen. Also they haven't worked together since and I've always heard references going back to the fight between them.,2012-01-12 10:05:00.533,1030
1981,377,"Good answer and thanks for clarifying when the actual fight happened. Though it does look as though in the book ""Live from New York"" there are a few differences on the way it happened (which happens with witnesses) it does explain the basic start of the fight.",2012-03-30 06:16:36.103,1549
1982,1768,"No problem from my side either, I just don't like to downvote without leaving a reason. I liked the question in principle, and you've got a good answer, and a few upvotes - so maybe i'm wrong :-)",2013-05-30 16:52:31.710,1126
1986,1408,"okay. At the same time, however, Zeus does do that push-up move when he is downed, which is just as robotic. Guess that just proves that they are both robots...",2013-02-16 22:09:37.717,1134
1990,613,Same movie I thought of but it's been so long since I've seen it that I don't remember if that scene is in it.,2012-06-15 10:29:36.000,653
1991,35,"+1 - Great answer, between Advicer and KevinHowell - nice to see some of the script to conclusively prove it.",2011-12-02 00:04:54.710,1063
1992,697,"Thanks for completing my answer with the script lines, Kevin. I was searching for the script too, unfortunately with no result.",2012-07-11 00:36:34.113,1774
1994,715,"+1 and accepted, I never got to finsih that movie back then, never thought I ever be able to even find what it was, thank you.",2012-07-17 05:56:19.813,974
1996,1116,"If you could add a reason why you think this is the movie, or provide some reference to your assumption, this answer would gather a lot more votes :)",2012-12-14 14:18:45.910,751
1998,662,"@Bernard Is The Quiet Earth really an I Am Legend rework? If you really think it is I would pose the similarity as a question as I'd love to see the analysis. It is a great movie, much underrated.",2012-06-30 01:38:47.990,1654
2000,1479,"@TylerShads: noted and thanks. I see that matt has already added a plot summary, so that should do it.",2013-03-12 05:15:25.300,1485
2001,1539,@matt_black: no worries.,2013-03-25 19:13:33.757,1538
2002,84,"I don't know. The movies are 40 years old, and my need to know whether they were sequels, prequels, spinoffs or the like was never strong. Just enjoy them for what they are: art.",2011-12-10 07:46:33.963,1299
2010,647,"Regulus only retrieved the locket.  He did not remove the curse on it.  To destroy the piece of Voldemort's soul that it contained the locket had to be destroyed or damaged so badly it couldn't be repaired.  Ron, after being mentally tortured by the locket with images of Harry and Hermione together, destroyed it in the Forest of Dean with Godric Gryffindor's sword in Harry Potter and the Deathly Hallows.",2012-06-25 16:04:41.980,890
2013,874,"Mmm. In the Deathly Hallows they steal the real locket back from Dolores Umbridge and then spend a lot of the time carrying it around, passing it from person to person because of the negative emotions it imposes on them.  They spend the time trying to work out how to destroy it and eventually do so like @Legion600 describes.  I'm not sure interpretation is really necessary - it seems pretty clearly spelled out.  If you disagree still, re-edit your answer back and I'll upvote Legion's answer instead.  Your answer is potentially the best apart from this (IMHO) error.",2012-09-12 19:36:56.567,335
2016,1586,+1 good explanation!,2013-04-11 23:49:59.307,1795
2017,841,"Not sure if it's a rework (probably not), but it's definitely not a movie to overlook. Feel free to post a question about it!",2012-08-30 04:35:24.607,967
2020,1605,One word: Badly.,2013-04-18 00:24:33.803,46
2022,1040,"at end of La Jette the man is indeed killed at the airport in the past. He is killed not by airport police but by a scientist from the future who was sent back to do the hit. just like 12 Monkeys, the man fell in love in past and tried to stay there, against orders.",2012-11-22 13:09:47.127,1294
2023,1131,"@iandotkelly,i agree with ur views and Legion600's:)Of course. Let me edit my answer.",2012-12-17 21:41:28.433,1492
2026,1125,"This is the process of converting ""normal 2D movies"" into 3D. Did you check the heading of the article and read through that? The quoted part, explains that graphic artists work on the shots and use computer simulation to add the perspective of second camera!",2012-12-16 07:14:18.357,259
2028,248,What does this mean: *That Gumb's first thought of a woman he didn't otherwise recognize was her size was enough to make Starling want to find out more*? It's hard to understand.,2012-02-01 15:24:20.027,879
2029,37,"@Tshepang: I can't remember, but presume Starling showed a photo Mrs. Littman's face to Gumb. He didn't recognise her, and the first thing he asked was if she was ""a great big fat woman"". This isn't usually what people ask, and she knows the killer is interested in larger women, so this was enough to raise Starling's suspicions to find out more.",2011-12-02 07:51:59.793,42
2032,815,"@Incognito, I agree that you did answer my question, and upvoted your answer to offset the -1.  However the first line was a little misleading and sounded like you were just going to explain how 3D works.  Your links were useful, but I accepted Advicer's answer because the second article he linked to addressed more of the issues in my question.",2012-08-23 23:41:47.880,278
2041,598,"You say and believe that, but you haven't offered convincing evidence of that. Something can be logical and magical at the same time. It is magical because you are proposing magical physics to explain the events. Not physics based on how our real world appears to work. Time travel is muddy when it doesn't subscribe to a predetermined or divergent multiple timeline system because our universe appears to be one of these two. Marty 2 watching Marty 1 should fade too, his future is again in just as much peril. If Marty 2 is safe, so is Marty 1 by definition, and neither should fade.",2012-06-09 04:54:21.303,647
2042,665,"Thanks @tcrosley. The first line was to give an outline of how 3D movies are actually made so that the process of converting 2D to 3D makes sense! And I agree, answer posted by Advicer deserves to be accepted as an answer.",2012-06-30 07:02:22.607,925
2044,386,"Marty 2 watching Marty 1 would not start to fade because his past has been secured. He has done it has happened in fact it's happening and he can see it. If Marty 1 did not succeed in getting his parents together then he would most likely instantly cease to be, there would be no fading. It's not muddy and it's not magical. The best physics example that I can think of would be Schrodinger's Cat Marty is both secured in his time line (Marty 2)and unsecured (Marty 1)at the same time. If you don't agree that's fine but like quantum mechanics just because you don't understand doesn't make it magic",2012-04-03 12:17:59.843,418
2049,497,"I guess we will just have to disagree on that.  I have seen both, a number of folks on the net confirm this, etc, etc.",2012-05-10 08:16:27.407,651
2050,84,"@VijinPaulraj : nop, or would have back tracked it in IMDB myself.",2011-12-10 06:46:33.963,1023
2052,672,How would waxing the car teach trust?,2012-07-02 02:19:56.523,534
2053,583,"+ 1 for mentioning the locket influence, hadn't thought of that, would + more if I could!",2012-06-07 02:28:28.740,624
2055,100,@AidanO. - thanks for the comment :),2011-12-15 03:23:47.453,1713
2059,703,Sounds almost a bit like crank but the colour element throws it.,2012-07-12 13:59:57.423,361
2060,1743,"@AidanO possibly due to all the seemingly worthless tasks, he'd see that he's becoming great at karate, and therefore trusts Miyagi seemingly insane ways of teaching karate.",2013-05-24 02:40:22.187,787
2061,1771,"I guess we will :-)  ... I would be interested in seeing any links you have on that.  Memory *is* a funny thing, but I saw Star Wars in 1977 and do think I saw that directly and not on a subsequent re-release.  I just had a brief look and can't find a reference that says it did not have Episode IV in the opening text.",2013-05-31 03:42:58.693,801
2062,644,"@TylerShads lol, I've tried the worthless tasks with the kid (aka housework), but it doesn't seem to inspire trust ;)",2012-06-24 05:19:55.870,1129
2065,94,"from imdb.  Upon its original release, the opening crawl did not include ""Episode IV: A New Hope."" According to Lucasfilm, this was added upon its re-release in 1981. The later print was the first one to be released on mass market video (an earlier Betamax release did not have the subtitle), and all video, laserdisc or DVD releases have featured the subtitles. The theatrical cut DVDs, released in September 2006, were the first time that the original opening crawl, without subtitle, has been released on home video.",2011-12-13 05:57:33.817,243
2067,258,I've never actually seen it I just remember reading about it once. The Mario Bros one sounds like a horrible idea.,2012-02-04 11:25:17.340,1532
2069,1767,There is every chance I am 'remembering' the 1981 release which I had on VHS.  I stand corrected and withdraw my answer.,2013-05-30 11:30:17.873,1440
2072,1620,[It's perfectly fine to ask and answer your own question](http://blog.stackoverflow.com/2011/07/its-ok-to-ask-and-answer-your-own-questions/)  Just as long as it is a good question to begin with :),2013-04-24 02:23:48.077,1130
2074,556,Makes me think of Buster Keaton's infamous 'horse sweat' scene in 'A Funny Thing Happened on the Way to the Forum'.,2012-05-30 08:20:54.487,653
2077,1074,"The 2006 dvd has the 1977 release on disk 2, There is no Episode IV and no A New Hope after STAR WARS and before the text of the crawl.",2012-12-03 01:38:11.363,86
2079,1449,"@Nobby: I haven't seen it - I was never a fan of silent movies, and don't know anything Keaton did after the ""talkies"" came in. But he must have been on his last legs in that one, since he died in 66 when it was released.",2013-02-28 20:25:34.867,1472
2080,1282,Thanks. I felt that maybe just the link might be too brief.,2013-01-16 05:39:36.783,876
2081,679,"His was a small role, and he was indeed an old man, but the gag never fails to make me laugh. I won't spoil it for you - it's a good film to watch late at night when you are drunk :)",2012-07-05 09:02:54.070,424
2082,1120,@Shawn Touche. So Small Wonder probably ripped off the books. Live and learn.,2012-12-15 11:49:15.410,63
2083,1349,"-1 I can't understand why anyone would up-vote this question?  ""I'm trying to identify a movie with very sweaty horses""!!  I don't even know why they were sweating! Similarly for the up-votes on the answer!",2013-01-31 11:54:31.183,185
2084,921,@AidanO - [Same people that upvote questions like this I guess?](http://movies.stackexchange.com/questions/1236/trying-to-identify-a-martial-arts-movie-i-thought-it-was-called-the-golden-arr),2012-10-04 10:45:30.213,1280
2086,481,@AidanO [Just proves that this site is community driven](http://meta.movies.stackexchange.com/questions/283/why-are-answers-with-minimal-information-getting-up-voted)  There are almost 900 users each with their own (hopefully) unique opinion :),2012-05-04 04:28:50.527,538
2087,1004,"@AidanO: Not my call really, but I would say in the movie it's hardly ""sweaty"" horses - they look like they've had cans of shaving foam emptied all over them! I thought it was quite striking, and it's possible others may remember the scene but not recall much else about what the movie was about or what it was called. If someone asked on writers.se [""I read this book where the narrator wrote of how eating a small tea-cake brought back vivid memories of childhood""](http://en.wikipedia.org/wiki/Involuntary_memory), would that not be a good question?",2012-11-08 09:18:09.163,210
2089,875,"@FumbleFingers now if you'd have said that in your question, I wouldn't have downvoted it!  I tried to remove my down vote but it's too late, so will upvote the comment, which i do think adds plenty to the question.  Sorry if I came across like a crank.",2012-09-13 12:12:52.273,718
2090,1018,"@AidanO: I'm not sure which bit of what I said in my comment would have made a difference, but please feel free to edit the question to reflect it - or anything else you think might ""improve"" it. The more I think about it, the more it seems to me questions seeking to identify movies by citing some ""iconic scene"" may actually become quite useful as part of a ""knowledge database"". It's usually easy to identify iconic lines of dialogue just through Google, but getting the right search terms for visual elements is a bit trickier - movies.se could end up being quite good for that.",2012-11-13 04:11:42.300,1392
2091,1708,"Yup, that's the one. Thanks!",2013-05-18 06:39:30.363,535
2094,466,@AndreiFreeman - not QUITE. The locket and her personality mesh.,2012-04-30 09:23:12.723,1013
2095,1048,"It's [Totem](http://inception.wikia.com/wiki/Totem), not token, sorry OCD :)",2012-11-25 09:41:25.030,1302
2096,813,"I like this answer a lot and it's similar to what I think as well but Cobb is very careful to not let Ariadne touch his totem at all even in the real world. In fact he advises that the totem is made and only touched by yourself so to speak. So he's using his wife's totem, and the guards in the beginning and Saito (Watanabe) have touched it, so how can he ever know if he's in a dream or not. I believe this is the only real determination that can be used to determine if Cobb is ever actually in the real world so I'm looking for why he would use his wife's totem.",2012-08-22 16:39:44.930,336
2100,1613,"@TylerShads: I agree, he is keeping and using the top for guilt/sentimentality.  It is true that Cobb may understand the totem properties - but us as the viewers cannot be sure of that, and it appears that the spin-forever/fall is so simple as to be useless.  The simplicity of the top is its undoing, and adds to our uncertainty of Cobb's state.",2013-04-21 18:44:01.063,975
2103,230,I don't think this is it.,2012-01-26 15:35:49.730,300
2104,532,"Funny then, because the Alvin doll says the same thing earlier in the movie, and Ian Hawke tells Dave that it's Spanish.",2012-05-18 04:07:44.643,1220
2106,1111,"I believe the answer, I'm just saying that it's strange that they would make such a big mistake.",2012-12-13 23:40:02.837,1026
2107,1609,I think they deliberately made this mistake to make Ian seem like an ignorant/fool. You can see that Dave's face expression is not very convincing.,2013-04-20 08:15:18.820,460
2108,992,which is from 73. Btw you can accept your own answer so that others won't search anymore,2012-11-02 10:30:10.113,444
2109,9,"Whilst this may theoretically answer the question, [it would be preferable](http://meta.stackexchange.com/q/8259) to include the essential parts of the answer here, and provide the link for reference.",2011-12-01 03:25:26.517,691
2110,454,"Well, whereas I can understand your curiosity, I don't think one should overinterpret such little gimmick scenes (whose only intention is to put a smile on the audience's face) too much, especially in the overly slapstick-heavy Moore-Bonds.",2012-04-25 01:35:22.693,101
2111,171,"Basically, you're saying that Dunham might've been overwhelmed?",2012-01-06 21:22:54.247,901
2112,552,"while a good answer in itself, I'm sorry but it is 100% not helpful to what I asked. I know very well the cultural origins of Baron Samedi, and read both wiki and IMDb before posting (without learning anything new). **I explicitly asked for information sourced from the people involved in making the movie**",2012-05-27 21:45:46.507,867
2114,802,You're right - the info I found wasn't up to par so I'll just place it in here for further edification:,2012-08-15 05:38:29.593,1269
2115,894,"The character of Baron Samedi is actually based on a voodoo deity rather than a real person, and one might suppose that this would account for his otherworldly powers. It should also be noted that he is not a strictly 'villainous' character - the baron is relatively neutral in his meddling with the affairs of the living, and so does not need to die (as befits Bond baddies in general).  There were also rumors that the Baron would be returning in one of the following films- but these rumors are uncorroborated.",2012-09-23 09:48:26.893,1513
2116,1511,Anyone else wish that Baron would return instead of Moore? :))),2013-03-18 20:34:06.803,1286
2118,1422,"I'm not an expert but the logical reason would be the editing of the video, which would have destroyed the sound synchronization of the sound was pre-recorded.",2013-02-21 13:51:21.467,1141
2119,782,God? He couldn't even crack an IRS D-Base!!! Pfeh.,2012-08-06 08:02:35.750,746
2122,800,I was going to say the same thing. Good answer +1,2012-08-14 22:32:35.693,1474
2127,235,"My search turned up Live and Let Die as the first time this comes up as a significant plot point. It's not surprising since this kind of topic would have violated the Motion Picture Production Code that was in effect from the early 1930's to the late 1960's. There could be a pre-code era film that had it, some were quite racy, but I couldn't find one right off.",2012-01-26 12:18:01.260,452
2129,1047,"I searched through imdb.com for some of the keywords from ""Live and Let Die"" including psychic and virginity.  I also looked through films with precognition as a keyword.  The earliest movie I could find with this trope was actually ""Live and Let Die.""   I can't say that's a definitive answer though.",2012-11-25 03:56:44.500,344
