Id,PostId,Text,CreationDate,UserId
2804,1345,"Here was Tyson's opinion on the matter, causing him to contact Cameron - _""There she is looking up. There is only one sky she should have been looking at ... and it was the wrong sky! Worse than that, it was not only the wrong sky; the left-half of the sky was a mirror reflection of the right-half of the sky! It was not only wrong, it was lazy! And I'm thinking, this is wrong.""_",2013-01-31 04:43:39.437,268
2805,561,+1 for great answer!,2012-05-31 11:48:12.213,573
2812,1229,Cool info - thanks for this! +1,2013-01-03 02:58:17.447,535
2815,1328,@atticae I enjoyed the ironic line: 'now it hit Titanic',2013-01-26 12:47:08.620,177
2816,412,"Do you count occurrences in the corresponding TV-shows (don't know if it ever happened there, long time since I watched them). If yes, you may want to edit your question to make it less *Ethan Hunt* specific. I don't think it ever happened in the movies (haven't seen the last one though).",2012-04-13 13:47:42.410,557
2817,153,"@ChristianRau he didn't refuse either.  And yes, I would make this more TV centric as there are only 4 movies in which he has accepted each mission.",2011-12-30 23:19:53.603,1137
2818,97,"@TylerShads That's what I thought. Taking only the movies into account makes a ridiculously trivial question. Othwerwise it would be quite interresting (even if not less trivial), as I always liked the shows, both the old one and the new one.",2011-12-14 08:54:19.367,933
2819,1207,It would make for an awfully short movie.,2012-12-30 05:22:01.533,1056
2821,743,"It would be easy to invent a scenario in which he refuses, but gets involved anyway.",2012-07-23 13:10:46.577,976
2822,1586,I'm under 30 and know what TV's White Noise is :p,2013-04-12 04:49:59.307,683
2823,894,[**NO**](http://en.wikipedia.org/wiki/Mission:_Impossible_(film_series)),2012-09-23 11:48:26.893,75
2824,662,it reminded me a lot of the scene in which bugs bunny  gets shot by yosemite sam in an episode and I totally forgot the dialogues for that looney tunes episode.,2012-06-30 11:38:47.990,1575
2825,1596,Freddy vs Jason :) i am pretty sure it came later than AVP thought it might be a good fit for the genre. Edit: It actually came prior to AVP.,2013-04-15 15:38:58.337,1754
2826,1341,+1 Great question!,2013-01-30 04:51:23.367,256
2828,359,"Great answer, thanks!",2012-03-19 00:34:00.967,1556
2829,1554,Thanks @Nobby :),2013-03-29 19:52:07.073,1359
2830,597,"I'm just pokin' fun, @TylerShads :)",2012-06-09 12:10:09.870,250
2835,124,Hi. Welcome to Movies & TV - thank you for your answer.  The IMDB writeup of The Wraith describes an invincible car.  What makes you think this is the right movie with an advanced motorbike? You can edit your answer if you think of some more detail.,2011-12-20 14:50:38.177,924
2836,267,Looks like I need to read the books more closely. Don't recall that part at all.,2012-02-07 20:39:49.437,1300
2837,1387,[Here's a clip of Tyson telling the whole story](http://www.youtube.com/watch?v=8B6jSfRuptY).,2013-02-11 02:26:47.243,873
2838,320,"Welcome to Movies & TV. Have you looked at all Amanda Seyfrieds movies on IMDB so you can exclude her? Any other details would be useful, like when did you see this, on what TV channel etc",2012-03-02 00:54:20.647,539
2847,934,thanks for the link! :),2012-10-10 03:24:55.960,446
2850,1199,ahahaah thats EXACTLY the one lol. THANK YOU!,2012-12-29 01:11:56.930,1488
2851,974,"I have a fear this may lead to discussion, but I will let the community decide how to handle this :)",2012-10-26 09:35:19.970,709
2852,1182,Ian nailed the answer I think - I would just add that Travolta's character was such a polar opposite to his previous roles (a violent drug user) that this was an aspect that was focused on by reviewers and added more meat to his resume.,2012-12-25 02:40:53.847,142
2853,1459,Wasn't Jacob instrumental in bringing the candidates to the island? I thought the idea was he constructed everything to get the candidates on that plane.,2013-03-03 05:20:32.960,1039
2854,1012,"I think spoilers are ok in answers, there's also spoiler markup. See also http://meta.movies.stackexchange.com/questions/16/whats-the-policy-on-spoilers",2012-11-10 02:08:17.387,611
2855,814,"@DisgruntledGoat In a way, you can say Jacob is an omnipotent being in that he constructed the series of events that brought them to the island, whether it be how he got them on the plane or somehow helping shape DHARMA in a way that they would construct the Swan and tell people that the world will end if the numbers aren't put in.  However, for discussions sake, I said the Swan caused the crash because in the end, it did.",2012-08-23 07:24:39.603,99
2858,1384,"An anonymous user added the second paragraph - should really be its own answer, but I can't convert it to another answer.",2013-02-10 08:39:07.210,866
2860,450,Actually I was waiting for this type of question; asking for an objective look at why a movie could be regarded *historical* or a *masterpiece* :),2012-04-24 03:21:58.267,818
2862,1331,"Not sure about this, according to imdb (http://www.imdb.com/title/tt0780504/trivia?tab=tr&item=tr1630109) Driver references the fable of The Scorpion and the Frog: the frog agrees to carry the scorpion across the river; the scorpion stings the frog, saying ""it's my nature"" and both drown. Driver can be seen as The Frog of the story - he drives/carries criminals (scorpions) around in his car, but is inevitably dragged into their destructive world (stung) leading to everybody's downfall. Driver's jacket has a scorpion on the back, just as the frog carried the scorpion on its back.",2013-01-27 04:52:27.337,214
2863,827,"In reality, my answer has only scratched the surface - as I have made no mention of Kurosawa's technical sophistication and mastery of mise-en-scene - but I hope it serves as a starting point for further answers.",2012-08-26 09:48:51.483,885
2865,1570,"I would prefer to find some quote from Nolan .. but the song is about the effect of memories on you - given double meaning as the line ""Ni le bien qu’on m’a fait ni le mal"" - Mal's name means Bad in French.",2013-04-07 19:50:13.343,575
2867,926,I'm sure it's also no coincidence given Marion Cottilard's Oscar winning role as Edith Piaf.,2012-10-06 19:05:00.337,127
2868,1336,@OliverG - what I have read says that it is a coincidence... but I can sympathize with your thoughts there.,2013-01-29 03:16:59.020,1166
2869,1771,@Nobby: Thank you so much for taking the time out to write a great answer. I understand what you are trying to get at. Thanks! Would love to learn more about the film from a technical point of view - either from you or someone else with expertise on this subject! Thanks again! :),2013-05-31 05:42:58.693,619
2870,534,"This makes me think of Castaway, which they shot in two parts, almost chronologically. For the first half, Hanks was his usual meaty self, then the production took 6 months off so that he could drop the weight, during which time Zemekis popped out to film 'What Lies Beneath', before returning for the second act on the island!",2012-05-19 23:47:27.417,1435
2878,1576,"I changed _are_ to _is_ in the title, see http://english.stackexchange.com/questions/64453/what-are-wrong-with-this-phrase",2013-04-09 07:17:03.483,7
2880,852,"+1 very detailed, thanks",2012-08-31 21:55:58.253,278
2883,1019,I added pictures with better resolution.,2012-11-13 16:45:22.133,1044
2884,1018,"Yea, I saw that one... sure seems like if the cannons were used it would be mentioned but the fact that they called them out is pretty extraordinary as it is.",2012-11-12 23:11:42.300,563
2885,303,"But both these scenes are before his ""hero-mid-life-crisis"" :/",2012-02-25 01:38:28.533,1630
2888,453,@Nobby I didn't know that. Thanks for letting me know.,2012-04-24 20:30:08.723,1034
2889,1745,"@abhiii5459 They happen before he **notices** that something isn't right. I doubt that the writers have gone so far, but some effects(like this one) can come up without you properly knowing that you have a problem(it's in the subconscious). I think it is a pretty good explanation.",2013-05-25 22:11:00.600,1497
2899,681,"I find it hard to believe that even a desperate man in Lovett's situation would spend that kind of money to bring Rose aboard, without some sort of promise of a return.  But it is a work of fiction... so I'm sure your answer is as close to correct as anyone will come up with.",2012-07-06 05:54:22.057,996
2900,665,"Where did you hear this?  With a reasonable source for this claim, it would probably be a good question for [Skeptics](http://skeptics.stackexchange.com/).",2012-06-30 23:02:22.607,1064
2901,640,"@JacobG ""I can't find any other relationship between the two."" – The fact that Ron Howard starred in both American Graffiti and Happy Days doesn't count? ;) Reading up on the history, Happy Days started as an unsold pilot that Paramount rejected, George Lucas asked to see the pilot to determine if Ron Howard would be suitable for his movie, then Garry Marshall recast the pilot to turn Happy Days into a series.",2012-06-22 22:22:09.423,167
2902,1694,"Examples, or it didn't happen.",2013-05-14 06:21:55.047,613
2903,564,"I doubt it. Newer movies just attract more attention than older movies. When older movies were released, there was no IMDB (or internet for that matter), so they have less votes. And the higher score is part of the hype. The score usually adjusts over time.",2012-06-01 16:09:28.217,581
2907,1014,"@ghoppe - Technically, I don't think that does count otherwise you could link Happy Days and Osmosis Jones based on the same criteria. :-)",2012-11-10 02:50:58.603,716
2908,1551,"It's an interesting question, but ultimately I never trust online rating systems (or printed for that matter). It's way too easy for like-minded fan groups (Twi-Hards etc) to skew the results through positive AND negative votes.",2013-03-28 22:09:39.817,640
2910,829,That is a good one! Makes sense to. Can you find any confirmation from the writers?,2012-08-27 02:58:22.577,1567
2912,901,"I look forward to the uncut version of the movie and i felt it would've been awesome if they had added ""Sweet dreams are made of this""",2012-09-24 22:05:27.147,33
2914,710,"Hmm, sounds more like a bio for [Linus Pauling.](http://en.wikipedia.org/wiki/Linus_Pauling#Molecular_medicine_and_medical_research)",2012-07-16 00:27:23.970,1510
2918,1169,"As a ""Jason,"" I can understand your interest in this.",2012-12-22 09:33:57.370,264
2920,1708,I was just about to post this. I hope the Visual Companion has a picture of Kevin.,2013-05-18 11:39:30.363,912
2922,1366,He was an older guy and got the treatment intravenously; looks like smooshie got the answer.,2013-02-04 17:36:38.447,1791
2926,29,Do you have any references of interviews or the such that explain this?,2011-12-02 09:00:27.077,543
2946,634,"At first I wanted to make this a general question about the cabin, but noticed it would end up being too broad, so I split it up. More cabin questions probably following. ;)",2012-06-21 20:08:25.707,1513
2949,1469,http://en.wikipedia.org/wiki/Parkour#Popular_culture http://www.hindu.com/fr/2006/11/17/stories/2006111702390100.htm,2013-03-07 16:33:09.933,316
2955,1094,"Although this is interresting info and it sounds plausible, it would be nice to know where you got this information from, because as it stands it's a mere statement, much like the one the OP wanted to get references for.",2012-12-09 04:54:20.723,223
2956,1258,"Well, you see, when two people love each other they...",2013-01-07 15:48:32.820,871
2959,1747,"I think this answer is correct.   ""The Reverse-Engineering division was developed after such incidents as the destruction of Gunnison County and the buy-out of Borgia Industries. Weyland-Yutani would capture alien tech and attempt to reverse engineer it. They would steal tech such as Predator weapons and Space Jockey technology. However, they would run afoul of the Predators, who were fiercely protective of their technology.""  That was taken from here. http://avp.wikia.com/wiki/Weyland-Yutani",2013-05-25 17:19:18.047,34
2961,1212,"Although I wholly agree with this excellent answer, it does raise a bit of a question regarding the alien's eyes. If the aliens do not actually have eyes, then why do their skulls (seen in Predator 2 and AvP) have eye sockets?",2012-12-30 09:15:06.290,1146
2962,1767,"I've voted your answer up because it is very complete and well considered. However, I was asking only about the film as the book is far less ambiguous, especially given how deeply entrenched Mercerism and the little black boxes are. Still, it seems possible in the book as Deckard does try hard but is still not very good at showing empathy. Abusing or killing animals or insects would be taboo and a psychopath might be able to fake it without close scrutiny but would still not be able to show enough empathy to pass the test, I think.",2013-05-30 11:30:17.873,1276
2975,1593,Those holes aren't eye sockets. They are part of the cheekbone that allows the jaw muscles to connect to the upper part of the skull. As seen in these image.  http://www.graspingatcreativity.com/wp-content/uploads/2010/04/attachment1.jpg and here to http://4.bp.blogspot.com/-KoQYrSJEwpk/TWOq5jBw0AI/AAAAAAAAAg8/VuTVsgSUE54/s1600/fifthskullug8.jpg,2013-04-14 23:05:23.987,159
2977,1314,"Did they ever censor it ? I don't recall any censoring apart from the prophet's double episode, part 2.",2013-01-23 14:31:15.003,72
2978,1680,"@Eregrith They did, also, famously Cartman Get's an Anal Probe: Kyle `You like to _____ and sh___ and _____ and _____ and _____ and _____!` Stan `Hey Wendy, what's a _____?` I noticed there are no alternative ""uncensored"" audio tracks on the earlier season's DVDs either...I get bleeps",2013-05-09 04:58:15.897,1122
2979,950,Oh yeah that's right,2012-10-16 00:15:11.720,741
2984,1743,"That's a cool link, reading through it though it seems to suggest different methods for the aliens to detctet it's prey: ""it is believed that it ""sees"" by sensing pheromones."" as well as the ""elector-reception""",2013-05-23 22:40:22.187,382
2991,119,"I'm talking about their actual non-broadcast releases, their DVD releases etc, in which they do actually censor. I understand that networks choose to censor their broadcast, but there are episodes Matt and Trey censor on purpose and as far as I can tell, they only started releasing uncensored versions around Season 9. Everything before that was bleeped or left blank, even though the transcript shows the profane content.",2011-12-19 20:15:51.117,536
2992,1615,"""lets assume the fight with the van towards the end is just another one of their internal struggles""....got so frustrated trying to explain this part to people.",2013-04-22 09:35:35.257,1030
2996,344,I suspect this question will get closed soon - so I hope this answer helps ;),2012-03-14 00:48:13.617,1512
2997,1266,The question was asked on [scifi.se]: http://scifi.stackexchange.com/questions/1520/in-what-order-should-the-star-wars-movies-be-watched,2013-01-10 02:56:23.173,704
2998,613,"Cool - thanks for clearing that up, Mathew.",2012-06-15 10:29:36.000,1198
3002,1716,"For us, there is no such thing as ""local video store""; sign o' the times.  The Clearplay looks interesting.  ty.",2013-05-19 21:18:14.183,282
3005,75,"@ChristianRau I'm not sure if it is ever explained that the building they're watching from is the same one they were fighting in.  However, all the context clues point to *no* because why would he blow himself up, not to mention, why would his crew meet him up there if it was to be blown up?",2011-12-09 13:05:12.090,1359
3006,1177,"@ChristianRau Also, I do not remember it being implied that they blow up at the end.  Is this something in the book (that I need to read)?  From what I could gather the implied ending is they watch the destruction of the financial buildings together, ""ushering in"" their ""new world"" of Project Mayhem.",2012-12-23 15:50:42.833,941
3008,1205,+1 great answer!,2012-12-29 09:20:37.230,854
3011,1105,"@TylerShads Well, it's just what I interpreted to happen, I don't think it's implied anyhow (haven't read the book, too). Why not blow himself up, he doesn't blow himself up, but the narrator, anyway. Blowing himself up at the climax of Project Mayhem would also be the ultimate climax of his crusade for self destruction, anyway. But well, I'm not sure what really happened (or if the audience ought to know it in the first place). But I still think it is the same building (if he rearmed it or not). Being part of the financial complex makes sense regarding the locality of the buildings.",2012-12-12 00:30:20.807,318
3012,511,"@TylerShads And exploding as part of the other buildings makes a bit of sense regardig the other buildings exploding one after the other (in a kind of domino fashion) until the scene closes abruptly (implying that the camera is gone, too), if I recall this correctly. But well, I'm not that sure of it, to say.",2012-05-13 05:38:10.650,254
3014,1498,"Thanks a lot. Interesting strategy, I like it +1.",2013-03-16 12:45:33.163,290
3018,1076,@ChristianRau it is an interesting view on the end I had not considered before and must consider next time I watch it :),2012-12-03 15:14:34.530,425
3028,1383,"Interesting, but still the _correct_ way to watch them is in the order of release.  But depending on the age of the viewer, that might be a good way to go as then it ends with an upbeat tone.",2013-02-10 02:31:22.153,1437
3030,1376,"Luke learns that Vader is his father in Episode V, so according to your suggested viewing order, you will learn this ""big surprise"" before starting to watch any of the prequels.",2013-02-07 14:58:53.780,1311
3032,944,"If you watch the prequels first you will learn that Vader is Luke's father before you see Ep V, thus spoiling the shock of discovery along with Luke. Here - read this article which started the whole trend (although I dispute the exclusion of Ep1) to understand why this order works the best. http://nomachetejuggling.com.s3-website-us-east-1.amazonaws.com/2011/11/11/the-star-wars-saga-suggested-viewing-order/",2012-10-14 02:42:00.470,565
3035,624,"I just watched a couple of scenes on YouTube, they didn't include the one you are mentioning, but the puns were very French. So the English puns must be different.",2012-06-18 16:43:02.523,1056
3037,772,"I don't want to repeat the 'it comes down to opinion' answers, but I do want to state that it isn't everyone's desire to be 'impressed' with the technology when they go to the movies, but in my case it is to be drawn into the movie. Yes, I went to 3D movies at first to enjoy how they throw stuff at you, and going with kids this is great fun. After a while that fun from the tech becomes rather dull, and I want a 3D movie to be rather more subtle and just add to the realism of what I am watching. Stuff flying out of the screen to make me jump just makes me realize more that I am in a theater. I",2012-08-01 01:48:06.333,982
3046,918,"You might have to clarify the people in this scene.  You talk about an adult boy and a young boy.  Are they the same person, as it is not entirely clear? If so, you need to choose whether they are grown up or not.  It might help giving them approximate ages.",2012-10-03 17:27:39.063,1410
3053,1578,+1 for the alternate theory!,2013-04-10 01:37:42.013,66
3057,480,@nobby +1 fro reply but let me check.,2012-05-04 07:47:42.200,1585
3060,1733,"i checked its trailer but its not the movie , even its hero is not young, he is too old as compare to my movie. And i am talking about a horror movie not comedy.",2013-05-21 19:30:39.353,1336
3061,958,I think that refers to the knives throwing rather than the punch-bag scene. nice link though.,2012-10-18 16:49:36.973,1264
3062,1293,"Given the title of the question ""Walking around someone who is in Slow Motion"", I thought they might have used the same technique, i.e. a circle of still cameras as mentioned in my answer.",2013-01-17 23:52:41.713,1538
3063,1022,"OK - I'll keep thinking. And contrary to the trailer, Naked Lunch is more horror than comedy, after all, it was directed by David Cronenburg :)",2012-11-16 01:39:16.647,1007
3065,319,"Hmm .. I thought as much - that they would be connected to the Construct. However, the entire setup (of showing people connected to the construct) from the Control room seemed too much of an effort to me - hence I thought that there would be some other explanation. Thanks for the quick response! :)",2012-03-01 15:07:27.407,409
3066,354,"*Naked Lunch* is **not** a comedy. The idea of someone thinking it's funny is a bit disturbing, actually.",2012-03-17 02:39:42.660,1352
3068,436,"@saurabhj yeah,there really isn't much beyond that unfortunately.  I do agree that it seems too much effort.",2012-04-18 04:07:56.977,258
3072,1348,"Yes, Ep1 is a chore (even as a life-long SW fan I'll admit this) but there are still some elements in it that have bearing on the story arc as a whole - plus my little guy LOVES the podrace :)",2013-01-31 17:49:29.870,796
3074,1051,"I disagree with @Coomie's remark. To clarify: The Fountain is not a science-fiction movie, this movie is about the power of meditation, the development of siddhis and expansion of consciousness, the Kundalini Awakening of tantric yoga and spiritual enlightenment, the third eye, this movie even has its roots in martial arts. The love story is just an illusion, the whole movie is about the Māyā of Life. This is a very profound and hermetic movie. Few movies really describe the Kundalini phenomena. 1. The Fountain 2. The Celestine Prophecy 3. Little Buddha 4. Matrix 5. Blueberry Search for ""Kunda",2012-11-26 08:21:46.723,1291
3076,292,"But *why* does it suit the movie, explanation is key to good answers.",2012-02-17 13:16:15.627,1702
3077,781,@TylerShads read the new edit it will clear the point,2012-08-04 17:17:43.963,382
3078,427,"Agree Episodes 1-3 are a travesty and a fine lesson in 'less is more' if you watched them all in the supposed numerical order there are no suprises, acting and story improve over halfway through, you get annoying side characters at the beginning and end and you get a Calculon style 'Nooooooo' from Darth at the end of 3 which leaves you little sympathy for his road to redemption in 6. IMHO Lucas should not be allowed to touch the Star Wars films again.",2012-04-17 03:05:07.220,911
3079,1786,"While a valid answer,  I think the OP wanted in reference to the movie :)",2013-06-04 06:21:57.033,567
3082,748,Ah hell - Brain Damage! I should have remembered that classic :) Saw it in a double-bill with Basket Case. Doesn't the parasite sing 'Elmer's Tune'?,2012-07-23 21:28:27.293,1461
3084,1474,"From your description, I would have guess *Joe’s Apartment*, but from Morbus’ answer, that’s not even close.",2013-03-10 10:27:43.393,124
3086,408,@Liath but i think the real answer is changed when they made the prequel of it.,2012-04-11 23:55:34.207,376
3087,1378,"This question won't really benefit much from guesses but more from actual information from producers, writers, etc.  See the **notice** below.",2013-02-08 14:51:42.807,1332
3090,857,"+1 for the point but i think they can do new things in main series too, i found this prequels are more  complicating then the main series.",2012-09-04 22:41:46.647,884
3091,1304,"Yea what you said makes sense, but my question is, when they make doors to the other universe, how can they be sure that they are creating a portal to the universe they want and not any other universe? I guess it's a detail they conveniently left out",2013-01-20 22:54:25.203,700
3092,458,"Thank you for your answer. So as I understand it, Mark Zuckerberg was probably never consulted nor gave permission to make this film. The only reason he probably wouldn't sue is that it would be too much of an effort for him. However, this seems like a pretty big risk that the filmmaker might have taken. Also, thank you for pointing out the Streisand Effect :) Learnt something new today!",2011-10-04 06:29:31.590,566
3093,966,@saurabhj - no problem.  I am sure that Mark did not approve the movie.  Thanks for the question.,2012-10-22 21:28:31.260,916
3095,1038,"@saurabhj - the movie was adapted from a book called The Accidental Billionaires which was written by Ben Mezrich. One of his primary sources was Eduardo Saverin, one of the four co-founders of Facebook and one of the people who has lawsuits against Facebook (it was settled out of court).",2012-11-21 15:27:08.027,1719
3096,596,"@saurabhj - the fact that the movie is about a lawsuit, probably makes it even harder for Mark Z to make any sort of serious claim against it... it would simply be too big a news story.  Better to largely ignore it.",2012-06-08 23:08:04.257,1248
3100,1208,"I only watched *Ferris Bueller's Day Off* one time some time ago (while waching the *Blues Brothers* occasionally) and it didn't occur to me, interresting question, though. I guess it's just the slightly chaotic adventure/odyssey feel, mixed with impressions from Chicago.",2012-12-29 22:31:41.673,1593
3101,1645,"Ah but it is hinted at that Xavier got a new body and ""The Cure"" is not as permanent as it seems.",2013-04-30 21:29:17.527,611
3102,449,"@TylerShads Oh yes, the final scene (with Magneto moving the chess figure) is indeed a nice hint for potential sequels. But what do you mean with Xavier getting a new body? Where was this hinted?",2012-04-22 07:41:09.587,344
3103,597,@TylerShads what are you talking about? Xavier got a new body?,2012-06-09 11:10:09.870,436
